詞條	中文	音節	釋義	頁數	備註	轉寫者
Lallaas	一種黃色的樹皮（用來作矛、編織、裝飾）	Lal.la.as	a fine yellow kind of bark, which people use, and sometimes insert for ornament: as their spears are wound round with red rattan and this bark alternately; the natives also weave the same split very fine, here and there, in their own coats, for ornament.	88		容榕_71-99
Lallatach	木杖	Lal.la.tach	a wooden stand, for a light. From Lûmmatagh.	89		容榕_71-99
Lolian	正午	Lo.lian	and lalian azijhja, midday.			容榕_71-99
Lallum	挖掘	Lal.lum	in, within. Molalitim, in, deep. Paolallum, transi. to make any thing deep, to dig deep.			容榕_71-99
Lamo	露水	La.mo	the dew; verb. malamo, to bedew; bedewed, or damp.			容榕_71-99
La-ob	穀倉（放工具、穀物）	La.-ob	an out house, where people keep all kinds of implements, rice, &c.			容榕_71-99
La-obbómas	倉庫（放魚、肉）	La.-ob.bó.mas	an out house; where people keep fish or flesh. Compounded of la-ob, and momas.			容榕_71-99
Lalka	雷	Lal.ka	the lightning. From Lumka.			容榕_71-99
Lalladan	墊子	Lal.la.dan	a cushion.			容榕_71-99
Lallokogh	梳子	Lal.lo.kogh	a comb.			容榕_71-99
Lalpi	睫毛	Lal.pi	the eyelashes.			容榕_71-99
Lemesoleso	一種傳統習俗，女人舞蹈結束後歡呼、喊叫。	Le.me.so.le.so	I: linenesoleso, lalenesoleso, lenesolesoa, to shout after the native manner, when the women have concluded a dance or song.			容榕_71-99
Lido	意義；解釋	Li.do	meaning, interpretation, explanation, li, la, lidoa. Palido, transit. Lido, opinion, meaning.			容榕_71-99
Libbe-adippi	錫	Lib.be.-a.dip.pi	tin			容榕_71-99
Limmichob	啜飲	Lim.mi.chob	linimmichob, lalinimmichob, lichobba, lichobben, linichob, inoli. chobben, to sip.			容榕_71-99
Limmabit	按壓	Lim.ma.bit	li, la, labitta, labitten, linabit, inolabitten, to pinch between two; but to press underneath is summelit; it means also to press against another.			容榕_71-99
Limmiod	扭；擰	Lim.miod	linimiod, lalimiod, liodda, liodden, liniod, inoliodden, to wring once round, to give one turn.			容榕_71-99
Limka	點亮；眨眼	Lim.ka	to lighten, to blink with the eyelids.			容榕_71-99
Loan	馬；牛；水牛；奴隸（用於輕視或怒罵時）	Lo.an	a horse, cow, buffalo, &c. also a servant, a slave. In this last sense the word is used in contempt or in anger.			容榕_71-99
Lo	岸邊	Lo	as roos, a shore.			容榕_71-99
Lummala	招來邪惡；纏住	Lum.ma.la	to induce, to incite to evil. Also to haunt. Palala, to tempt; lalala, a temptation, a ghost.			容榕_71-99
Lúmmalak	恐嚇	Lúm.ma.lak	to threaten by word or action.			容榕_71-99
Lummaliech, li, la,(接頭詞)	小病	Lum.ma.li.ech, li, la,	a little sick, in disposed.			容榕_71-99
Lummapies	跪下	Lum.ma.pies	to kneed, to press down			容榕_71-99
Lûmmapilapies	lûmmapies找不到相應字	Lûmmapilapies	linummapilapies, lalûmmapilapies, lapilapiessa, &c. the same as lûmmapies, lallapilapies.			容榕_71-99
Lûmmaslas	贖回	Lûm.mas.las	to redeem any one from punishment, with money.	91		容榕_71-99
Lûmmatagh	樹立	Lûm.ma.tagh	to set on a stand.	91		容榕_71-99
Lûmmauk	求婚	Lûm.ma.uk	to court, in order to marriage.	91		容榕_71-99
Lummaulatāb	將火燃得很旺；（用火）煮東西	Lum.mau.la.tāb	to make burn brighter or clearer. Also to cook or boil anything by a clear fire.	91		容榕_71-99
Lûmmias	（像眼睛般）打開	Lûm.mi.as	to open, as the eyes.	91		容榕_71-99
Lûmmibach	在肚皮上畫	Lûm.mi.bach	to draw in one's belly.	91		容榕_71-99
Lûmmido	否認	Lûm.mi.do	to deny; lallido, a denial.	91		容榕_71-99
Lûmmis	發怒	Lûm.mis	to glow, also to look angry.	91		容榕_71-99
Lûmmitûllito	（樹、竹等）搖搖欲墜	Lûm.mi.tûl.li.to	to totter, to wave; is only used concerning great things, as trees, bamboos	91		容榕_71-99
Lûmmióllio	追逐、獵捕	Lûm.mi.ól.lio	to run after, to hunt.	92		容榕_71-99
Lûmmo	陪伴	Lûm.mo	to accompany.	92		容榕_71-99
Lûmmobo	偷竊	Lûm.mo.bo	to steal.	92		容榕_71-99
Lûmmochod	丟出繩子	Lûm.mo.chod	to give out rope.	92		容榕_71-99
Lûmnugot	發誓	Lûm.nu.got	li, la, logotta, logotten, linogot, inologotten, to vow; as kûmmotkot.	92		容榕_71-99
Lummokugh	梳	Lum.mo.kugh	linûmmokogh, lalûmmokogh, lokogcha, lokogchen, linokogh,inolokogchem, to comb.	92		容榕_71-99
Lûmmolo	（鹿、山羊等）從四面八方聚集	Lûm.mo.lo	to drive together from all sides; is used of animals, as deer, goats	92		容榕_71-99
Lûmmoob	拋媚眼	Lûm.mo.ob	to look wantonly.	92		容榕_71-99
Lûmmoog	碰觸；戲弄；虛度	Lûm.mo.og	to touch, also to trifle, to pass away the time.	92		容榕_71-99
Lûmmoog	對過去受惠的事心存感恩地安排下一件事情	Lûm.mo.og	li, la, loomma, passi. loommen, limoon, ino-loommen, seems to mean, to arrange any thing with the acknowledgement of a previous benefit; as làmmoon oatite, oramied. Lalloom, nom. Whenever any one will acknowledge that another has done a service for him, he presents something of what he has acquired to him who procured it for him; which people call Lûmmoon oatite.	93		容榕_71-99
Lammosagh	挖出；提起（過去的事情＿	Lam.mo.sagh	to dig any thing up that was buried, also to bring up old things long since done.	93		容榕_71-99
Lûmpi	閃爍	Lûm.pi	to twinkle as the fixed stars, to blink.	93		容榕_71-99
Ma-a-addo	kannaddo找不到對應字	Ma.-a.-ad.do	a disswader: kannaddo.	93		容榕_71-99
Ma-a ba	智者；先知	Ma.-a ba	a wise man. From maba. Maaijaab, a prophet. From Me-aab.	93		容榕_71-99
Ma-ababaas	信使	Ma.-a.ba.ba.as	a messenger, one who brings tidings.	94		容榕_71-99
Ma-abalizich	運輸機	Ma.-a.ba.li.zich	a transporter.	94		容榕_71-99
Ma-abba	多產的（植物、動物、人）	Ma.-ab.ba	fruitful, used generally of plants, animals, or men.	94		容榕_71-99
Ma-ababodda	多產的（野獸）	Ma.-a.ba.bod.da	fruitful; said of beasts.	94		容榕_71-99
Ma-acha	謀殺者	Ma.-a.cha	a murderer.	94		容榕_71-99
Ma-achab	小偷	Ma.-a.chab	a thief.	94		容榕_71-99
Ma-ado	廚師	Ma.-a.do	one who understands cooking, a cook.	94		容榕_71-99
Ma-achachad	受惠/受報應的人	Ma.-a.cha.chad	a rewarder of good or evil.	94		容榕_71-99
Ma-achachuppir	固執；不遵守	Ma.-a.cha.chup.pir	stubborn, disobedient.	94		容榕_71-99
Maag	醋	Ma.ag	vinegar	94		容榕_71-99
Ma-aita	視力極好的人	Ma.-ai.ta	a sharp sighted man.	94		容榕_71-99
Ma-aja	施予者	Ma.-a.ja	a giver	94		容榕_71-99
Ma-akakossi	叛亂者	Ma.-a.ka.kos.si	a disobedient ring-leader of rebellion.	94		容榕_71-99
Ma-alabo	土地富饒的	Ma.-a.la.bo	fruitful, said of the ground.	94		容榕_71-99
Ma-allal	仁慈的	Ma.-al.lal	kind, benevolent. Dan minaallal mamallaal a-allalla, a-lalal-len, ina-alallen, ino a-alallen. Al-al, bland.	94		容榕_71-99
Ma-alalloog	恐懼的	Ma.-a.lal.lo.og	frightened, appalled.	94		容榕_71-99
Ma-aat	測量師	Ma.-a.at	a measurer.	94		容榕_71-99
Ma-allallobo	小偷	Ma.-al.lal.lo.bo	a theif	94		容榕_71-99
Ma-arab	喝醉的人	Ma.-a.rab	one who makes drunk.	94		容榕_71-99
Ma-aragh	受惠很多的人	Ma.-a.ragh	one who receives or obtains much.	94		容榕_71-99
Ma-arien	女神職人員	Ma.-a.rien	a priestess	94		容榕_71-99
Ma-arra	無業遊民；生活清靜、不受打擾	Ma.-ar.ra	unemployed, one who has nothing to do. Also at peace, and undisturbed. g: a-arra.	95		容榕_71-99
Maa-rapies	壞人；罪人	Ma.a.-ra.pies	a sinner, a villain.	95		容榕_71-99
Ma-ararait	能配合伴奏唱得很好的人	Ma.-a.ra.rait	one who can sing well in company.	95		容榕_71-99
Maaru	冷	Ma.a.ru	cold; as masûmah.	95		容榕_71-99
Ma-arari	看守人	Ma.-a.ra.ri	a watchman. From ûmi.	95		容榕_71-99
Ma-arrat	一群魚	Ma.-ar.rat	a sort of fish, like the cod.	95		容榕_71-99
Madrich	愛面子的；注重形象的	Mad.rich	activ. fond of distinction, shame-faced, to carry oneself modestly towards another whom men honour. Aärichag. Paarich, to honour any one; or to be ashamed before any one, a-arich, honour, a sense of shame. Ma-aarich, one who honours another, or conducts himself modestly.	95		容榕_71-99
Maas	抓（一種用網捕魚、蝦的技巧）	Ma.as	to catch, as chūmmaü: also a certain mode of fishing with a net, to catch shrimps, called audn. Aas, a besom, but only such as are made of a certain plant called alsoaas; otherwise it is chachań.	95		容榕_71-99
Ma-asannan	嫉妒者	Ma.-a.san.nan	an envier.	95		容榕_71-99
Ma-asasarra	貪睡的人	Ma.-a.sa.sar.ra	one who sleeps much,a sluggard.	95		容榕_71-99
Ma-asiklai	吹橫笛的人	Ma.-a.sik.lai	a fifer, one who plays well on a flute.	96		容榕_71-99
Maaspat	八	Ma.as.pat	eight	96		容榕_71-99
Ma-assas	遊手好閒的人	Ma.-as.sas	a sluggard.	96		容榕_71-99
Magspaspat	八個八個	Mag.spa.spat	eight by eight.	96		容榕_71-99
Ma-asasiri	哭泣的人	Ma.-a.sa.si.ri	a crier.	96		容榕_71-99
Ma-asasat	鐵匠	Ma.-a.sa.sat	a smith.	96		容榕_71-99
Ma-asassis	跟屁蟲	Ma.-a.sas.sis	a tailer.	96		容榕_71-99
Ma-dsoso	施予者	Ma-d.so.so	a giver	96		容榕_71-99
Ma-asselakko	徒勞無功的	Ma.-as.se.lak.ko	useless through indolence, worthless.	96		容榕_71-99
Ma-atattûppa	記憶力很好的人	Ma.-a.tat.tûp.pa	one who has a good memory. From tumpa.	96		容榕_71-99
Ma-asassabach	有毒的	Ma.-a.sas.sa.bach	poisonous; fr. Sumbach.	96		容榕_71-99
Ma-atinnaam	先驅	Ma.-a.tin.na.am	a forerunner.	96		容榕_71-99
Ma-attallalattala	慰藉	Ma.-at.tal.la.lat.ta.la	a comforter	96		容榕_71-99
Maat	湍急的河流	Ma.at	is used only of the swelling of rivers, not occasioned by the sea ortide: proût, mi, fut, ma; transi. paat; nomen ańt. Mabarrija ačt o sabba, the fresh of the river is very strong, or the stream is strong, Aataijan, the lower part of a river where the running out of the water makes the river greater and stronger.	96		容榕_71-99
Maat	木柴	Ma.at	mi, ma, aata, is used for fire wood; thus they say; maat-eeb, to cut fire wood: trans, paat. pi. pa. ipaata.	96		容榕_71-99
Ma-atattosik	騙子	Ma.-a.tat.to.sik	or ma-atattose, a liar. From tummosik, from tûmmose.	97		容榕_71-99
Ma-otattaas	前任；祖先	Ma.-o.tat.ta.as	a predecessor in any thing.	97		容榕_71-99
Ma-atite	傳教士	Ma.-a.ti.te	one who speaks openly to the people, a preacher. Ma-atil, a minister. From pattite, from patil,	97		容榕_71-99
Ma-ataúso	醫生	Ma.-a.taú.so	a Doctor. From Pataûso.	97		容榕_71-99
Ma-auba	懶散的人	Ma.-a.u.ba	one who is always drowsy: from moba.	97		容榕_71-99
Ma-at-ach	健忘的	Ma.-at.-ach	forgetful: from poach.	97		容榕_71-99
Ma-adridda	拋棄了他的伴侶的男人或女人	Ma.-a.drid.da	a man or woman, who deserts his or her partner: from moriedda.	97		容榕_71-99
Ma-aunat	縱火者	Ma.-au.nat	one who sets any thing on fire: from ponnadi or monad.	97		容榕_71-99
Maauso	鰥夫寡婦	Ma.a.u.so	a widow or widower:	97		容榕_71-99
Ma-aussi	（遊戲中）藏起某物	Ma.-aus.si	one who hides any thing in play.	97		容榕_71-99
Maba	理解	Ma.ba	minaba, mamaba, to know, to understand; ma bada saan, and zies, an understanding heart, g: maba, seems also to mean, to acknowledge. Maabam charsar ja ta Labba; I know Labba's voice. Pala, transi. Aba, knowledge, science. Ma-aba, a wise man. Intendit. mababa; nom. ababa; abako taposai, omniscient.	97		容榕_71-99
Ma-baas	在地上爬行	Ma.-ba.as	minabaas, mamabaas, abasa, abasem, inabaas, ino-abasen, to creep. Pabaas, trans, to crawl: mabaas morab is very fine weather; malaas mariollo, when the beasts eat grass: when it is foul and rainy weather, and the beasts lie in the grass: nom. abaas, a creeping. Ma-abaas, a creeper.	98		容榕_71-99
Maabat	人或動物的步伐；正在接近的東西	Ma.a.bat	minababat, mamababat, ababadda, the gait of men and beasts. Also the moving onwards of any thing that moves locally. Pababat, transit. imp, ababadda, ipababadda. Ababad, a path, a way. Pass. ababadbad, iniden, inababad, inoababadden, ipabapababad, inoiapabad. Ababadden iata, the ground is trodden.	98		容榕_71-99
Mababosa	正在衰老的人	Ma.ba.bo.sa	an old man, one who is getting old.	98		容榕_71-99
Mabachas	使乾燥	Ma.ba.chas	mi, ma, abachasa, to be dry; bachas, drought. Pabachas, to dry; activ. imp. ipabachasa, transi. passi. abachassen, activ. obachassen, inobachas, inoabachasen, ipabachas, inipabachas, inoipabachas; people say in short, mabas en palas. Ma-abachas, dryness, drought.	98		容榕_71-99
Mahach-ich	直的	Ma.hach.-ich	unbent. From pabach-ich, mi, ma, an unbending, a diversion. Ma-abachchich, one who diverts.	99		容榕_71-99
Mabadas	表達喜悅、滿足	Ma.ba.das	mi, ma, same as mamacho.	99		容榕_71-99
Mabaddabadda	凝視	Ma.bad.da.bad.da	to look hard, to stare.	99		容榕_71-99
Mabad	頁眉	Ma.bad	mi, ma, abadda, abadden, inabaddan, inoabaddam, the running of the paper in writing. Mabad o barritok.  Differs from momach. Pabad, trans. abad, a flowing.	99		容榕_71-99
Maballa	滲漏	Ma.bal.la	mi, ma, oballa, o ballaan, inoballa, ino-oballaan, to leak; differs from misosso; maballa, when the hole is large and it leaks much, and misosso, when the hole is smaller and it leaks a little. Patiballa, transi.	99		容榕_71-99
Mabarra	強壯	Ma.bar.ra	to be strong; g; abarra, mi,ma, barra, strength. From Mabarra. Ma-abarra, a strengthener. Pabarra, trans. ipabarra, et activ. imp. abarra. Pass. ipabarra,inipabarra, inoipabarra, acti, abarran, inabarra, inoabarran.	99		容榕_71-99
Mabarras	突擊	Ma.bar.ras	minabarras, mamabarras, abarrassa, abarrassen, inabaraas, inoabarrasen, to proceed against the enemy, in order to fall on him by surprise. Pabarras, ipabarrassa, imp. trans. nom. abarras, a going forth against the foe. Ma abaras, to go forth.	100		永賦_100-128
Mabarran. mi	有穿衣服的	Ma.bar.ran. mi	ma, abarranna, neutr. not naked; pabarran, act. et trans.	100		永賦_100-128
Mabarri	吹	Ma.bar.ri	minabarri, mamabarri, abarria, to blow; pabarri, transi. abarria, ipabarria, imp. to blow. Pas. barrin, binarrin, ino-barrin, trans. ipabarri, inipabar-ri, inoipabarri. Barri, nomen. the wind.	100		永賦_100-128
Mabart	like maries	Ma.bart	mi, ma, like maries.	100	不知怎麼翻成中文	永賦_100-128
Mabasso	有香味的；好吃的	Ma.bas.so	scented; mi, ma, abassoa, also well tasted, neutr. is said of salmon. which smells or tastes well. Basso, nom. taste or smell. Pabasso, smelling good, to make tasty; imp. act. abassoa, trans. pabassoa, pas. bassoan, binassoan, inobassoan, pabasso, inipabasso, inoipábasso.			永賦_100-128
Machopûl	好吃	Mac.ho.pûl	(the o short) to taste well, activ. mi, ma, imp. achopulla, pass. achopullen, inochopul, inchopullen a taster, one who prepares the food.	100		永賦_100-128
Mabaûaas	a dangling in play after which they shout	Ma.baû.aas	mi, ma, imp. abauasa, a dangling in play after which they shout.	101		永賦_100-128
Mabázibat	正好；就算	Ma.bû.zi.bat	mi, ma, abazibadda, just, even; mapospos, contrarium, mi, ma, apospossa, papospos, transi. pospos, nom. Pabazibat, pi, pa, ipabazibadda, transi. act. abazibadda, nom. bazibad. Pass. act. bazibadden, binazibad, inobazibadden, trans. ipazibad, inipazibad.	101		永賦_100-128
Mabág	擁抱；用雙手拿；拿在手上	Ma.bûg	(the last a is scarcely heard,) minabagh, mamábagh, abágcha, abagchen, inabagh, inoabagchen, to embrace, to take in both arms, also to carry on the arms. Pa-bag, transit.	101		永賦_100-128
Mabido	是黑色的	Ma.bi.do	mi, ma, abidoa, to be black. Pabido, transi. and imp. ipabidoa, ipabido, inipabido, inoipabid, acti.abidoa, passi. abidoan, inabidoan, ino-abidoan.	101		永賦_100-128
Mabilla	劈開的	Ma.bil.la	mi, ma, abilloa, neutr. cloven. Pabilla, act. and trans. Billa, a cleft. Maabilla, cleft.	101		永賦_100-128
Mabillaag	使變大	Ma.bil.laag	mi, ma, abillaga, pabillaag, to enlarge, nom. billaag, breadth. Ma abillaag, trans. en acti. one who enlarges. imp. abillaga, pas. abillagen, inabillaag, inoabillagen, ipabillaga, ipabillaag, inipabillaag, inoipabillaag. Mabillabillaak, flat.	101		永賦_100-128
Mabinnas	健康的	Ma.bin.nas	mi, ma, abinnassa, healthy. Pabinnas, trans. to heal. transi. et act. impr. abinnassa, ipabinnassa, pas. a binnassen, inabinnas, inoabinasa, i. pabinassa, ipabinnas, inipabinas, inopa-binnas. Binnas, health. Abinnas, a healing. Mabinnas, a restorer, a healer.	102		永賦_100-128
Mabinni	肥的；肉體的	Ma.bin.ni	mi, ma, abinnia, fat, fleshy. Pabinni, to fatten, trans. et acti. imp. abinnia, abinni-in, inabinni, inobinni-in, ipabinnia, pas. ipabinni, inapabinni, ino-ipabinni. Binni, fatness, abinni, a fathom. Maabioni, a fattener.	102		永賦_100-128
Mabior	維持在後方	Ma.bior	mimabior, mamabior, abiorra, to remain behind without going forth. Pabior, trans. et act. imp. abiorra, ipa-biorra, pas. inabiorran, inoabiorran, ipabiorra. ipabior, inipabior, inaipabior. Bior, nom. is used as a preposition. Ma-abior, to remain behind.	102		永賦_100-128
Mabirbir	a composing of the mind in anger	Ma.bir.bir	mi, ma, abirbirra, abirbirren, inabirbir, inoabirbirren, abirbirren, a composing of the mind in anger. Mabirbir itsies, to pacify. Pabirbir, ditto. Abirbir, nom. a composing, a pacifying, a pacifier.	102		永賦_100-128
Mabissas	準備好去任何地方或去做任何事	Ma.bis.sas	minabissas, mamabissas, abisassa, to make one's self ready, to go any where or do any thing. Perhaps also ready. Pas. pabissas; trans. et act. abissassa, abissassan, inabissas inoabissassen, ipabissassan, pas. ipabissas, inipabissas, inoipabissas. Abissas. nom. preparing. Maabissas, a preparer.	102		永賦_100-128
Mabisse	品德高尚的	Ma.bis.se	mi, ma, abissa, upright in mind, virtuous. Pabissen, trans. et act. imp. abissea, abissei, inabisse, inoabissein, ipabissea, pas. ipabissi, inipabisse, inoipabissen. Ma-abisse, to make righteous. Babisse, righteousness.	103		永賦_100-128
Mabisse bisse	is only said of many	Ma.bis.se bi.-sse	as mabise; bisse, is only said of many: ja mabisse bisse tape ja tatakorroe, as straight as a line; intend. mabisse. Bisse bisse, intend. babisse, see pisse. Ma-abisse bisse, to make right, upright.	103		永賦_100-128
Mabo	可憐（某人）、原諒、運送	Ma.bo	minabo, mamobo, aboa, aboan, inaboan, ino-aboan, to pity, to forgive, to deliver. Pabo, pinabo, papabo, ipaboa, ipabo, inipabo, inoipabo, ditto. Anything done out of compassion is abo, iniabo, ino jabo, Abo, nomen forgiveness, abonno babossi. Bo, grace, mercy; bo no tsies. Ma abo, one who pities.	103		永賦_100-128
Mab-o	腐爛	Mab.-o	mi, ma, ab-oa, neutr. to rot: pas. rotten. Pab-o, trans. ab-o, a rotting.	104		永賦_100-128
Maboas	移除	Ma.bo.as	minaboas, mamaboas, aboasa, to remove. Paboas, trans. pass. aboasas, inaboasas, inoaboasas, ja, ta, i-aboas, ini-aboas, ino-iaboas ja ballag; nom. aboas, a removal. Ma-abaas, a remover.	104		永賦_100-128
Maboch-o	臭（動詞）	Ma.boch.-o	minaboch-o, mamabogh-o, to stink. Paboch-o, trans. et acti. imp. aboch-on, pas. aboch-oan, ipaboch-oa, ipaboch-o, inaboch-oan, inoaboch-oan, inipaboch-o, ino-ipabocho. Bocho, stink.	104		永賦_100-128
Maborra	使和平	Ma.bor.ra	miniaborra, mamaborra, aborra, to be pacified, neutr. Borra, an ally, from maborra. Ma-aborra, a peace maker. Aborra, pacifying. Paborra, trans. et act. imp. aborra, ipaborra, to pacify.The pas. act. trans. aborran, inaborra, ino-aborran, ipaborra, inipaborra, inoipaborra.	104		永賦_100-128
Maborried	顛倒的	Ma.bor.ried	mi, ma aborrieda, neutr. overturned; the root, porried.	104		永賦_100-128
Maborroch	凸起的；顛簸的；有角的；非圓滑的	Ma.bor.roch	raised, bumpy, angular, not round. Maborroch a sies, maborrogh a torran, maborroch ja morra &c. Paborrogh. trans. et act. imp. aborrogga, ipaborrogga, pas. aborroggen, inaborrogh, inoaborroghen. ipaborroggen, inipaborrogh, ino ipaborroghen, Borroch, a bump.	104		永賦_100-128
Mabosso	磨損、改變	Ma.bos.so	mi, ma, abosoa, neutr. to wear away, to change. Paboso, pi, pa, imp. abosoa, pass. abosoan, inobosoan, ipabosoa, inipaboso, inoipaboso, to wear off.	105		永賦_100-128
Macha	死的	Mach.a	dead. Cho macha, a dead man; also dry, dried up. Macha da baron, dry wood. Macha da ta, dry land. Pacha, to kill, acti. imp. acha, achar, inácha, ino achan, trans. ipacha, inipacha, inoipacha. The neutr. has no other noun than macha itself. It is also the verb macha, mi, ma, acha, to die. Acha, a death blow; nom. Ma-acha, a murderer.	105		永賦_100-128
Mach-yato	流過	Mach.-ya.to	to flow through.	105		永賦_100-128
Mach-achio-a-oogh	as machio-a-oogh	Mach.-a.chio-a-oogh	as machio-a-oogh.	105		永賦_100-128
Machachod	姦夫；淫婦；有外遇的人	Mach.a.chod	an adulterer or adulteress. From chûmmod.	105		永賦_100-128
Machab	祕密地進行某事	Mach.ab	minachab, mamachab, achabba, achabban, inachabban, inoachabban, to do any thing secretly. Pachab, transi. Achab, theft. Ma achab. a thief.	105		永賦_100-128
Machaddak	附近的	Mach.ad.dak	near, not far, mi, ma, achaddikka: neutr. paehaddik, trans. et acti. nom. chaddik, is used as the preposition prope. Radix chûmmaddik. Maûbe a chaddik, to look near. Ma-achaddik ocho, a neighbour, one who is near.	105		永賦_100-128
Machallo	清澈的	Mach.al.lo	mi, ma, achalloa, clear; machallo a to, clear water: machallo a boesûm, clear air: machallo a tattorrodauron, a clear mirror. Pachallo, trans. et activ. Gallo, nom. clearness. Machallochallo, intend. Ma-achallo, clearer. Pachallo, act. achalloa. pas. ipachalloa, trans. achalloon, inachalloon, inoachalloon, ipachallo, inipachallo, inoipachallo.	106		永賦_100-128
Machal-pod	盡頭	Mach.al.-pod	the end, mi, ma, achal-pod-da, to come to the last, completed as machil. Achalta, or achalpodda dûmmoro tapos, come in together. Minachalt, or minachal-pod sohsa tapos, they are all gone in together. Pachalt, is acti. et. Pachalpod, trans. finished. Achalta, achalten, inachalt, inoachalten, imp. pas. Pachalta, ipachalt, inipachalt, inoipachalt.	106		永賦_100-128
Machammochammo	深的	Mach.am.moch.am.mo	deep. Machammochammo-nochaûch, spoken of a well. Mina, mama, achammochammoa, any thing dark and dismal as in a well. Mamarorammo, is used also by the Takey people Chammochammo ai? morammo, nom.	106		永賦_100-128
Machanagh	有凹口的	Mach.a.nagh	mi, machanacha, nertr.? notched. See chûmmanach. Chanag, a notch in an arrow.	107		永賦_100-128
Machapor	話少的	Mach.a.por	mi, ma, g: achaporra, of few words, not to speak much, to be sti? Pachabor, transi. et acti. Machapochapor, intend. Chapor, nom. silence. ? is chapachapor. Ma achapor, one which keeps silence: imp. ahaporra, ?, inachaporran, inoachaporra, ipachaporra, pas. ipachapor.	107		永賦_100-128
Machaogh	有凹洞的；粗糙的	Mach.a.ogh	pitted, rumpled, rough. Pachauch, trans. et acti. imp. achaûcha, achaûchen, inachaûch, ipachaûcha, pas. ipachauchen, inipachauch, inoachauchen, inoipachauch. Chaûch, a well. Ma achauch, a well digger.	107		永賦_100-128
Maghappo	發光的 （精神好的）	Magh.ap.po	glowing, metaphorically used of ardent spirits; because th? make the face to glow. Pagappo, glow. acti. trans. imp. apappoa, agpoan, inagappoan, inoagappoan, ino ipagappo.	107		永賦_100-128
Macharapo		Mach.ar.a.po	mi, ma, acharapoa, neutr. chûmmarappo.	107		永賦_100-128
Macharrieb	隱形的，用於風、神靈	Mach.ar.rieb	mi, ma, acharriebba, invisible, is used of wind, spirit, &c. Acharrieb, nom. Ma acharrieb, one who renders any thing invisible.	108		永賦_100-128
Machatto	抽煙	Mach.at.to	mi, ma, achattoa, to smoke. Pachatto, acti. trans. imp. achattoa, achattoan, inachattoa, inoachattoan, ipachattoa, pas. ipachatto, inipachattoa, inoipachattoa. Chatto, nom.	108		永賦_100-128
Mache	猜測某事物是否平均	Mach.e	mi, ma, imp. achea, pass. acheën, inache, inoacheën, to guess whether any thing is even or uneven.	108		永賦_100-128
Machaûbon	開玩笑；戲耍；空閒地坐著	Ma.chaû.bon	minacheaubon, mamachaeaûbon, pas. acheaubonnan, inacheaûbonnan, inoachaûbonnan. Acheaubonnan, to jest, to joke, to sit idle, to dally. Acheûabon, nom. dallying. Ma acheaubon, to trifle. Ta ja don acheaubonnan, the place where people play.	108		永賦_100-128
Mach-do	甜的	Mach.-do	sweet: mi, ma, achedoa, （the e short） chedó, sweet. Ma achedo, a sweetener. Pachedo, transi.	108		永賦_100-128
Macheer	靈敏的	Ma.chee.r	ingenious, mi, ma, acheer. Pacheer, trans. et act. pi, pa, imp. achera, acheran, inacheran, inoacheran, ipachera, pas. ipacheer, inipacheer, inoipacheer. Cheer, wit.	108		永賦_100-128
Macheda	意圖	Ma.che.da	intend. machedacheda; mi, ma. acheda, pas. achedaûn, & c. to change one's word or will. Pacheda, trans. Cheda, changeableness.	109		永賦_100-128
Machen	兄長；姊姊	Ma.chen	an elder brother or sister: eousin or nephew.	109		永賦_100-128
Machia	後悔	Ma.chia	minachia, mamachia, achia, to repent, to change one's mind. Pachia, transit. to change any one. Achia, repentance. Ma achia, one who exhorts to repentance.	109		永賦_100-128
Machi-ag chi erab	胡說	Ma.chi-ag chi e.rab	mi, ma to drivel: achi achi erab, or machi achi, mi, ma, achi a chia, this is also to leak; nom. achi a ch, and achi a chi erab, slaver. Ma achi achi, one who drivels. Pachia chi erab, and pachi a chi, transi. Ma chiagchi, composed from machiagchi, to leak, and erab, spittle. Machiagchi ohallaonan, the pot leaks. Achiagchi in, inachiagchi in, ina achisgchi in ja to, the water is leaked out.	109		永賦_100-128
Machiëgh	烤	Ma.chi.ëgh	minachiegh, mamachiegh, neutr. to roast; achiecha, to broil, trans. Pachiech, to boil, the root is chummiegh, see the nomina; activ. siet P.	109		永賦_100-128
Machigilla	非常熱的	Ma.chi.gil.la	mi, ma, achigilla, nearly like medadorri, Takeijs. Chiegh, a roasting. Ma achiegh, a roaster, as ma achachieg. Chieg, roast. Ma achieg, any thing roasted	109		永賦_100-128
