詞條	中文	音節	釋義	頁數	備註	轉寫者
Sumpo	幫忙某事	Sum_po	sinûmpo, sasumpo, suppoa, suppoan, sienpon, inosuppoan, to help, to lend a hand in any work, as Molliol. Pasuppo, pi. pa. ipasuppoa, ipasûppo, &c. to cause such to be done.	279		晴方_274-302
Ta	男性專有名詞前方的前綴虛詞	Ta	a particle prefixed to all proper names of men, as Ta Cabba, Ta Bai, &c.	280		晴方_274-302
Ta	領土、土地或住所；普通道路或街道、地面。	Ta	territory, land or dwelling place; the common road or street, the ground.	280		晴方_274-302
Tû-aka-idas	半月	Tû-a_ka-i_das	a half moon.	280		晴方_274-302
Tûan	一個抓野生動物的陷阱	Tû_an	a snare, for catching wild beasts.	280		晴方_274-302
Taamen o rapies	乞求；沒有羞恥地要求任何事情	Ta_a_men o ra_pi_es	tsi. tat. imp. taamen o rapisa, pas. taamen o rapies, tsinaamen o rapies, inotaamen o rapies, to beg, to demand anything without shame, nom. Ma-ataamen o rapies a beggar.	280		晴方_274-302
Tabba	當地的伐木者	Tab_ba	a native chopper. Fr. tummabba.	280		晴方_274-302
Tabboen	成人	Tab_bo_en	full grown, adult.	280		晴方_274-302
Tûbboeron	一個家族	Tûb_bo_er_on	a family sprung from one stock, relations.	280		晴方_274-302
Tûbillo	風笛或小號	Tû_bil_lo	a bag-pipe, or trumpet.	280		晴方_274-302
Tûbtab	下雨時沒有積水的地方	Tûb_tab	a place where no water settles, when it rains. Matabtab, the verb.	280		晴方_274-302
Tûbo	大葫蘆	Tû_bo	a large gourd.	280		晴方_274-302
Tach	濕氣	Tach	moisture, sap. From Matach.	280		晴方_274-302
Tûch-anas	淡水蝦	Tûch-a_nas	shrimps that are taken in fresh water; also teor, a large kind; rauno, a small kind of shrimps, which are found in salt water, Aûan, very small shrimps.	280		晴方_274-302
Tadûch	熱	Ta_dû_ch	heat. From Matadach.	281		晴方_274-302
Taddachal	人們拉下土的工具	Tad_da_chal	an instrument with which people pull down earth	281		晴方_274-302
Taddai	龍脷，一種魚	Tad_da_i	a sole, a sort of fish	281		晴方_274-302
Taddakal	女子佩戴的頭帶	Tad_da_kal	a head band, such as the women wear.	281		晴方_274-302
Taddaries	鎖	Tad_da_ri_es	a lock. From dûmmarri.	281		晴方_274-302
Tûddogon	人或獸的上方部分	Tûd_do_gon	the upper part of a man or beast	281		晴方_274-302
Tagga	血	Tag_ga	blood. From Matagga.	281		晴方_274-302
Taggausasan	一些竹子放在屋內門口上方	Tag_gau_sa_san	certain cross bamboos placed above the entrance of the door of a house, on the inside.	281		晴方_274-302
Taggargar	鐵索	Tag_gar_gar	a cable, from takkat and arrat. See takkar, and gûmmûrgar.	281		晴方_274-302
Taggoggoach	血管	Tag_gog_go_ach	a vein. Compounded of tagga and oggach.	281		晴方_274-302
Taggogon	使口渴	Tag_go_gon	zinûggogon, tataggogon, to thirst. Pataggogan, pinûtaggogan, p*pataggogan, ipûtaggoganna, to cause to thirst. Toggogon, nom. thrist.	281		晴方_274-302
Taikien	一種珠子；深受當地人的推崇	Ta_i_ki_en	a kind of beads, much esteemed by the natives.	281		晴方_274-302
Taitai	螢火蟲	Ta_i_ta_i	a fire-fly.	281		晴方_274-302
Tûkkar	錨，人們在渡口停泊船的柱子	Tûk_kar	an anchor, a post to which people moor a boat at a ferry.	281		晴方_274-302
Tûkkeein	矮人	Tûk_ke_e_in	a dwarf.	281		晴方_274-302
Talcko	極度的；優秀的；極度強大；罕見的熱	Tal_cko	exceeding, excellent, as talcho mabarra, talcho matadach, exceeding strong, uncommonly hot.	281		晴方_274-302
T*hoach-o	精通的人；超過他人的權力、財富、美貌	T*hoach-o	one who excels, or surpasses might, wealth, beauty, &c.	282		晴方_274-302
T*	什麼? 帶有憤慨	T*	what? with indignation. Talla *mmara imónos, what* do you lie * rags?	282		晴方_274-302
T*s	陶瓷碎片	T*s	a pot sherd	282		晴方_274-302
T*	一粒米	T*	o no adda, a grain of rice.	282		晴方_274-302
T*		T*	o noeno, the brain pan: written *lao-n-oeno.	282		晴方_274-302
T*piech	大鏢	T*piech	a large dart.	282		晴方_274-302
T*li	酢漿草	T*li	sorrel.	282		晴方_274-302
T*chon	持續的毅力	T*chon	continual perseverance. Tal-*hon sisa, the whole day. Tûllachon *n, micham, mababat, to be constant-eating, drinking, going, &c.	282		晴方_274-302
T*aian	西班牙痘	T*aian	the Spanish pox.	282		晴方_274-302
T*mimme	馬鈴薯	T*mimme	potatoes.	282		晴方_274-302
T*moes	碎屑；碎片	T*moes	crumbs, fragments.	282		晴方_274-302
T*moesan	崩塌	T*moesan	crumbled.	282		晴方_274-302
T*aas	"表讚美的虛詞，像 ""啊!"""	T*aas	a particle of admiration, as ah! * that!	282		晴方_274-302
T*ch-a	一副馬褲	T*ch-a	a pair of breeches.	282		晴方_274-302
T*rri-parri	手拉車	T*rri-parri	Takeis, a cart. Go-or, or *or. Tateûrraû loan, the poles of a *t. Asasûû loan, the yoke.	282		晴方_274-302
T*s	全部	T*s	all	282		晴方_274-302
T*oesan	蜜蜂	T*oesan	a honey bee.	282		晴方_274-302
T*ara	蜘蛛	T*ara	a spider.	282		晴方_274-302
Tûr	各種污染，例如鼻涕，油脂等	Tûr	all kinds of pollution, as from snot, grease, &c.	283		晴方_274-302
Tarren	焦油污染的任何東西，見下文	Tar_ren	anything defiled with tar, see below.	283		晴方_274-302
Tarra	刺魚，有兩種: 刺魚或長得像鯊魚的魚	Tar_ra	a thornback, of which there are two sorts, tarra boetsina, a thornback: tarra paga aubaas, a fish somewhat resembling the shark, with a broad blotch on the nose.	283		晴方_274-302
Tarrabeoan	彩虹	Tar_ra_be_o_an	or Tarraboan, a rainbow.	283		晴方_274-302
Tarra ie rain	眼睛流下的水	Tar_ra ie ra_in	tsi. tat. the trickling of the eyes. Patarra-ie-ra-ien, transit.	283		晴方_274-302
Tarrakal	一個高高聳立的小木屋，當地人經常在裡面睡覺；位於他們的房屋旁邊或田野中	Tar_ra_kal	a small hut, standing high in which the natives frequently sleep; such as are beside their houses, or in the fields.	283		晴方_274-302
Tarran	道路	Tar_ran	a way; mitarom' o taran, two roads that meet together. Rariedda **ran, a way that divides into two.	283		晴方_274-302
Tarrar	與 tabtab 同	Tar_rar	as tabtab. Verb Matarrar.	283		晴方_274-302
Tarraras	瓷器	Tar_ra_ras	porcelain, china ware.	283		晴方_274-302
Tûrrer	一種魚	Tûr_rer	a sort of fish.	283		晴方_274-302
Tûrribat	東西的傾斜度	Tûr_ri_bat	the obliquity of a thing.	283		晴方_274-302
Tarran	令人討厭的或傷人的	Tar_ran	tsinarran, inotûrran: and **ban, inarriban, inoarriban: and rib**jen, rinibaijen, inoribaijen. Seems ** mean loathsome, or hurtful. Thus people speak of unusual food, arriban o ** macha ja micho. It is possible that it ** injurious or deadly. But these words require to be more carefully examined.	283		晴方_274-302
Tûssaban	使飢餓	Tûs_sa_ban	zinûssaban, inotassaban, to hunger. Pûtassaban, pinûtassaban, pa-pûtassaban, ipûtassabanna, to cause to hunger. Nom. Tassaban, hunger.	284		晴方_274-302
Tassinan	為某人做某事	Tas_si_nan	tsinassinan, inotassinan, tassioa, to do anything for any one. Inatassinan ja rûmmozi-daû tamau, I will pay for my father. In the 2nd and 3rd person people do not say Tassinan, but Tassi. It is necessary that this word be examined. It is to be written tas-ina, just as daû-ina, for me; so also tasi-je, for you; tas-icho, for him. Præt. tsinas. fut. inosas, imp. tas ioa, sie d'r fas joa ina, take my place.	284		晴方_274-302
Tasso	新的和未用過的。指人們習慣使用的所有工具，例如衣服，杯子，餐具等。	Tas_so	that which is new and untried. Is said of all implements, that people are accustomed to use, as clothes, cups, dishes, &c.	284		晴方_274-302
Tûsso	長的，用來指無生命物	Tûs_so	(the o short) long, is only used of lifeless things.	284		晴方_274-302
Tatabbis	扇子	Ta_tab_bis	or boezina, a fan.	284		晴方_274-302
Tûsso	問句後的虛詞	Tûs_so	a particle wherewith people enquire after any place, as dema tassone Doubale, whither does Daubale lead to? Tassono don o Batsjekan, whereabouts are the houses of Batsjekan? Dema tassono Taijoan, which is the way to Taijoan? Tassono aisi, that way.	284		晴方_274-302
Tatûap	人們用於房屋建築或農業的各種工具	Ta_tû_ap	all kinds of implements that people use for house buildings or agriculture.	285		晴方_274-302
Tûtapannabonna	耕地	Tû_ta_pan_na_bon_na	arable land.	285		晴方_274-302
Tûtas	一英尋（測量水深單位，合1.8米或6英尺）	Tû_tas	a fathom.	285		晴方_274-302
Tûtkach	狩獵時圍著鹿的繩子	Tût_kach	the ropes wherewith the deer are encircled in hunting.	285		晴方_274-302
Tatkachannabonna	狩獵場	Tat_kach_an_na_bon_na	hunting ground.	285		晴方_274-302
Tûttabba	用於刺傷的工具，如劍，刀等	Tût_tab_ba	instrument for stabbing, as a sword, knife, &c.	285		晴方_274-302
Tattabbak	跳舞，或是那些將要戰鬥的人的踏步	Tat_tab_bak	a dance, also the trampling of those who are about to fight.	285		晴方_274-302
Tatsibûul	當人們不敢提及令人反感的人時，所用的語帶保留的詞	Tat_si_bû_ul	and a-obog, both words of reserve when people do not dare to mention scandalous persons.	285		晴方_274-302
Tatta	碾米機	Tat_ta	a ricestamper. From tummatta.	285		晴方_274-302
Tûtta o numma	我怎麼知道？	Tût_ta o num_ma	how do I know?	285		晴方_274-302
Tûtaam	答案	Tû_ta_am	an answer. From Tûmmam.	285		晴方_274-302
Tûttabach	第一個；原則	Tût_ta_bach	the first, the principal. Tummabach, and Matattabach, verb to, be the first.	285		晴方_274-302
Tûttachum	帽子	Tût_ta_chum	a cap. From Tummachûm.	285		晴方_274-302
Tattugga	顎骨	Tat_tug_ga	the jawbone.	285		晴方_274-302
Tattaggoch	用來繪圖的工具	Tat_tag_goch	an instrument to draw with.	285		晴方_274-302
Tattachil	from Tûmmachil.	Tat_ta_chil	from Tûmmachil.	285		晴方_274-302
Tattagga	切割工具	Tat_tag_ga	instrument for cutting.	285		晴方_274-302
Tattakka	支柱	Tat_tak_ka	a stanchion. From Tumka.	286		晴方_274-302
Tattakkis	可以用來縫的東西	Tat_tak_kis	anything to stitch with.	286		晴方_274-302
Tattakab	遮蔽物；亭子；繩子	Tat_ta_kab	a covering, a pavilion, a cord.	286		晴方_274-302
Tattatsain	一步	Tat_tat_sain	a step. From tûmmaein.	286		晴方_274-302
Tattallas	人們用來踩的，例如腳	Tat_tal_las	that with which people tread, as the feet. From tummallan.	286		晴方_274-302
Tattas o kokko	梳子	Tat_tas o kok_ko	the comb, &c. of cocks.	286		晴方_274-302
Tatte	魚鉤	Tat_te	a fish hook. From tumme.	286		晴方_274-302
Tattippi	用尾巴叮咬的生物所叮咬的傷口	Tat_tip_pi	the sting of anything that stings with the tail.	286		晴方_274-302
Tattallatala	組成的任何一個	Tat_tal_la_ta_la	that wherewith we compose any one. From Tummalûttala.	286		晴方_274-302
Tattallumtum	人們遮蔽自己以自由出汗	Tat_tal_lum_tum	that wherewith people cover themselves in order to perspire freely. From tummallumtum.	286		晴方_274-302
Tattauraija	害怕	Tat_tau_rai_ja	a frightening.	286		晴方_274-302
Tattear	惡臭	Tat_te_ar	a stenchion. From Tummear.	286		晴方_274-302
Tattamman o bisa o loan	箭桿	Tat_tam_man o bi_sa o lo_an	the shaft of an arrow, the stem of a spit.	286		晴方_274-302
Tattoch	數字	Tat_toch	a number. Masanno attoch, the larger number. From Tûmmoch.	286		晴方_274-302
Tattolillis	火花	Tat_to_lil_lis	a spark. From Tummolillis.	286		晴方_274-302
Tatollo	see tattûllo, below.	Ta_tol_lo	see tattûllo, below.	286		晴方_274-302
Tattorrodauron	鏡子	Tat_tor_ro_dau_ron	a-looking glass.	286		晴方_274-302
Tattorrodon	一個副本、範例	Tat_tor_ro_don	a copy, an example.	286		晴方_274-302
Tattarod	引人注目	Tat_ta_rod	a beholding.	286		晴方_274-302
Tattuppa	想法；回憶	Tat_tup_pa	thought, memory.	286		晴方_274-302
Tatto	人們用來點火的東西	Tat_to	that wherewith people kindle.	286		晴方_274-302
Tatto o telp	鑰匙	Tat_to o telp	a key. Tatto o chirrap, a toothpick. From tûm-o.	287		晴方_274-302
Tatto-oche	食指	Tat_to-oche	the fore finger.	287		晴方_274-302
Tattoob	用來灑水的工具	Tat_toob	an instrument, wherewith ** to sprinkle water. From tummos.	287		晴方_274-302
Tattoos	平台	Tat_toos	a plane. From tûmmoos.	287		晴方_274-302
Tattonnos	東西被折斷或撕裂的末端	Tat_ton_nos	the end where anything is broken off or torn. But especially pr**o extremitate membri virilis id quod e**st inhonestum.	287		晴方_274-302
Tattopoch	戴在耳朵上的裝飾品	Tat_to_poch	the ornaments worn in the ears.	287		晴方_274-302
Tattottoan	由當地人提出的要約；一塊堅硬的石頭	Tat_tot_to_an	an offer, by the natives. a hard stone: from tummotto.	287		晴方_274-302
Tattorrik	謊言	Tat_tor_rik	tattose, and tattosik, a lie. From tummorik, tummose, &c.	287		晴方_274-302
Tattullo	蠟燭	Tat_tul_lo	a candle. From tummollo.	287		晴方_274-302
Tattûltul	一束稻草，人們用來產生煙或是驅除蚊子	Tat_tûl_tul	a wisp of straw, with which people make a smoke, to drive away the musquitos.	287		晴方_274-302
Tattummauku	see tummauka.	Tat_tum_mau_ku	see tummauka.	287		晴方_274-302
Tattuppuk	一個預先計算的數字	Tat_tup_puk	a number reckoned beforehand. From tumpuch.	287		晴方_274-302
Tau	頭髮	Tau	the hair of the head.	287		晴方_274-302
Taugo	一種圓錐形的水果	Tau_go	a sort of fruit, conically shaped.	287		晴方_274-302
Taurok	一種與食物一起煮熟的蔬菜	Tau_rok	a kind of vegetable, which is cooked with the food.	287		晴方_274-302
Tautazillien	小手指	Tau_ta_zil_li_en	the little finger.	287		晴方_274-302
Taz-i	風箏	Taz-i	a kite.	287		晴方_274-302
Tazirra	舌頭	Ta_zir_ra	the tongue.	287		晴方_274-302
T*z-imo	各種準備好的食物，無論是魚還是肉	T*_z-i_mo	all sorts of prepared food, whether fish or flesh.	288		晴方_274-302
T*z-ino	鳥喙	T*_z-i_no	the beak of birds.	288		晴方_274-302
T*z-ipok	用來繪畫的鉛筆	T*_z-i_pok	a pencil to paint with. Taz-ipok o bido, a pen.	288		晴方_274-302
T*zirrisan	用來掛東西的大頭釘或木椿	T*_zir_ri_san	a pin or peg, on which to hang anything.	288		晴方_274-302
T*a	手臂	T*a	an arm.	288		晴方_274-302
T*babon	鴨子	T*_ba_bon	a duck.	288		晴方_274-302
T*es	額頭的上部	T*es	the pole or the upper part of the forehead.	288		晴方_274-302
T*e-o	鸛	T*e-o	a stork.	288		晴方_274-302
T*-te	附有果實的莖，無論是在田間還是已收穫的	T*-te	a stalk, to which the fruit is attached, whether standing in the field, or already reaped.	288		晴方_274-302
T*ter	打每一個人	T*ter	is said of thous who strike every one. Eirreken, idem. Written teteen.	288		晴方_274-302
T*llabien	一種魚，叫做石鯛	T*l_la_bien	a sort of fish, called stone bream.	288		晴方_274-302
T*lli	獾	T*l_li	a badger.	288		晴方_274-302
T*llik	一隻眼睛失明，因此看不到眼白	T*l_lik	blindness of one eye, so that the white of the eye cannot be seen. for then it is tollas.	288		晴方_274-302
T*llikken	一隻眼睛失明的人	T*l_lik_ken	one who is blind of one eye, this is the præs. from tummillik.	288		晴方_274-302
T*nnaam	某地點之前	T*n_na_am	before, with respect to place. Talla zummada zinoe, ka oa tinnûam ai, what do you seek, it lies there before you. Matatinnûan, mi. ma. forwards. Patatinnûam, trans.	288		晴方_274-302
To	水	To	water.	289		晴方_274-302
To oetas	雨水	To o_e_tas	rain water.	289		晴方_274-302
To sabba	河水	To sab_ba	river water.	289		晴方_274-302
To cha-och	井水	To cha-och	well water.	289		晴方_274-302
To abbas	水	To ab_bas	see water.	289		晴方_274-302
To-ak	一種鳥	To-ak	a kind of bird.	289		晴方_274-302
Toch	一個數字	Toch	a number, & tatoch, a numbering.	289		晴方_274-302
Tochab	一個洞；門；窗	To_chab	a hole, a door, a window. From tummochab, tattochab, an opening.	289		晴方_274-302
Tochorochen	咳嗽	To_cho_ro_chen	zinochorochen, tatochoróchen, to be set a coughing.	289		晴方_274-302
Togea	骨髓	To_ge_a	marrow.	289		晴方_274-302
Togea	狙擊	To_ge_a	snipe.	289		晴方_274-302
To-i	碎片	To-i	a splinter.	289		晴方_274-302
Tok	平靜	Tok	a calm. From pattok.	289		晴方_274-302
Tokkilli	年輕男子穿戴的鈴鐺	Tok_kil_li	jingles, worn by young men.	289		晴方_274-302
Tomo	像小疣的面皰	To_mo	pimples, like small warts.	289		晴方_274-302
Tomoon	很多面皰	To_mo_on	full of pimples.	289		晴方_274-302
Tomma	誰?	Tom_ma	who?	289		晴方_274-302
To-o	海角	To-o	a sea horn.	289		晴方_274-302
To-or	格柵	To-or	a lattice, a grating.	289		晴方_274-302
To-obabat	發育過度的男子	To-o_ba_bat	an overgrown man.	289		晴方_274-302
Tonso	一個中文單詞，意思是祖國	Ton_so	a Chinese word, meaning Fatherland.	289		晴方_274-302
Tooma	閱讀清單	To_o_ma	tsi. tat. imp. tara, pass. ta-an, tsina, inota-an, the reading of a list. Pata-a, tran. nom. tattûa, the reading aloud; and Maatttata-a, one who reads the roll.	289		晴方_274-302
Toppi	一種蘆葦，人們用它們來做箭	Top_pi	a sort of reed, of which men make arrows.	290		晴方_274-302
Torritorri	螢火蟲	Tor_ri_tor_ri	a firefly, as tai-tai.	290		晴方_274-302
Torro	我們	Tor_ro	we, us. But differs from namo.	290		晴方_274-302
Tosarri	一種長笛	To_sar_ri	a sort of flute.	290		晴方_274-302
Tosarri o a gorro	一種很長的長笛	To_sar_ri o a gor_ro	the same sort of flute; very long.	290		晴方_274-302
Totto	心	Tot_to	the heart.	290		晴方_274-302
Totton	東西的頂部或上部	Tot_ton	the top or upper part of anything.	290		晴方_274-302
Tollas	一隻眼睛失明，但可以看到眼白	Tol_las	blindness of one eye, but so that the white can be seen.	290		晴方_274-302
Tos-asjiem	牙痛	Tos-as_ji_em	tsi. tat. tosasjiena, pas. tosa-sjienen, tsinosasjien, &c. to have the tooth-ache. Tos-asji, the tooth-ache.	290		晴方_274-302
Tsimibarasabasa	直接瞄準	Tsi_mi_ba_ra_sa_ba_sa	tsi. tatsi. tsibarasabasûa, to aim at drectly, as tsimisi.	290		晴方_274-302
Tsimianna	不信任	Tsi_mi_an_na	tsini. tatsi, tsianna, &c. see in Zimianna, to be distrustful.	290		晴方_274-302
Tsimijk	提出要點	Tsi_mij_k	tsini. tatsi. itsijka, itsijk, initsijk, inoitsijk, to filli p, to make a point thus [.] nom. tattsik, a tittle point. See zimiek, under Tummesik, ditto.	290		晴方_274-302
Tsimikak	see under in Z	Tsi_mi_kak	tsini. tatsi. &c. see under in Z.	290		晴方_274-302
Tsimiki	好色地看	Tsi_mi_ki	tsini. tatsi. tsikia, to leer, to leok askance. Patsiek, trans. tatsiki, nom. Ma-atatsiki.	290		晴方_274-302
Tsiniko	拉緊懸空的房子	Tsi_ni_ko	tsi. tats. tsikoa, pass. tsikoan, tsiniko, inotsikoon, to tight a house that hangs over. Patsiko, trans. nom.	290		晴方_274-302
Tsimimis	嚐一些食物	Tsi_mi_mis	tsini. tatsi. tsimisa, tsimisan, tsinimisan, inotsimisan, to take some food, to taste. Paksimi, to cause such to be done.	291		晴方_274-302
Tsimipi*siep	像在吸手指或菸斗，但不是乳房	Tsi_mi_pi_*siep	tsi. tat. tsipisiepa, pass. tsipisiepen, tsimipsiep, inotsitsiepen, to suck (but not the breast) as a finger, tobacco pipe, &c. Patsiptsiep, trans. Tatsiptsiep, a sucking. Ma-atatsip-tsiep, a sucker. Tsiptsiepan, that of which men suck, as a tobacco pipe, &c.	291		晴方_274-302
Tsimisakal	see Zimisakal	Tsi_mi_sa_kal	see Zimisakal	291		晴方_274-302
Tsimisi	see Zimisi, tatsisi, nom.	Tsi_mi_si	see Zimisi, tatsisi, nom.	291		晴方_274-302
Tsimijtsjies	切斷木頭或竹子的節	Tsi_mij_tsj_ies	tsini. tatsi. tsijtsijsa, to cut off the joint of wood or bamboo.	291		晴方_274-302
Tsipan	西方	Tsi_pan	west. Matatsip, mi, ma, weatherly. Patatsip, trans.	291		晴方_274-302
Tumbar	像那些害怕被推走的人一樣趕快安頓好自己	Tum_bar	tsinumbar, tatumbar, tubarra, tubarren, tsienbar, inotubbarren, to set one's-self down fast, as those do who fear being pushed away. Pûtûbbar, panatûbbar, &c. to cause such to be done.	291		晴方_274-302
Timboel	找尋某人	Tim_bo_el	tsinûmboel, tatûmboel, tubboela, tubboelen, tsienboel, inotubboelen, to seek any one. Patubboel, pinatubboel, papatubboel, ipatubboela, ipatubboel, &c. to cause to be sought. Tattubboel, nom. henve kar tattubboel, mau tattubboel.	291		晴方_274-302
T**ho	鞠躬	T**_ho	tsinumcho, tatumcho, tûchoa, let the u be scarcely heard) tuchoan, **enecho, inotuchoon, to bow, Patû-**o, pi. pa. ipatuchoa. to cause to bow.	292		晴方_274-302
T**hoa	北季風的開始	T**_ho_a	tsi. tat. tóchoa, the commencement of the north monsoon. Provb. **choa ja masias sai don ja dalij ma*roos ja badda, they use this pro**b, because the young men do not **rry unless in the cold season.	292		晴方_274-302
T**ka	支持	T**_ka	tsi. tat. tikka, &c. (let the u be scarcely heard) to support, to prop up.	292		晴方_274-302
T**tukka	造成支持	T**_tuk_ka	pi. pa. ipatukka, &c. to cause support. Tattûkka, nom. a prop.	292		晴方_274-302
T**kach	將自己隱藏在洞中和斷崖後面以獵殺鹿	T**_kach	zinumkach, tatumkach, tuk-**cha, tukkachen, zienkach, inotuk-**chen, to hunt deer by concealing one's-self in the holes, and behind the edges. Patukkach, pinûtukkach, pa*ukkach, &c. to cause to hunt.	292		晴方_274-302
T**am	造成回答	T**_am	zinummaam, tatummaam, ta-*, tûmen, zinaam, inotamen, to an-*er. Pûtaam, pinûtaam, papataam, **tama, &c. to cause to answer.	292		晴方_274-302
T**aap	在室內或野外進行各種工作	T**a_ap	tsinummaap, tatummaap, ta-*tapen, tsinaap, inotapen, to do all kinds of work, either in the house or in the field. Also to attack, to fall upon. **maap, husbandry, &c. passiv. pret. tataap, work, labour. Ma-atataap, a worker, a labourer.	292		晴方_274-302
Tummaas	開始；首先做任何事；被另一個人追隨	Tum_ma_as	zinummaas, tatummaas, tasutasan, zinasan, inotûsan, to begin, to do anything first, to be follwed by another. Pataas, pi. pa. ipatasa, ipataas, inipataas, to cause to begin, &c.	293		晴方_274-302
Tummabbo	黏貼	Tum_mab_bo	zinummabba, tatummabba, tabba, tabbaan, zinubba, inotabbaan, to stick. Patabba, pinûtabba, papatabba, ipatabba, &c. to cause to stick.	293		晴方_274-302
Tummabach	首先做某事	Tum_ma_bach	tsi. tat. imp. tabacha, pass. tabachen, tsinabach, inotabachen, to do anything first; see also matattabach. Patabach, trans. to cause to be done. Tattabach, nom. a commencement.	293		晴方_274-302
Tummabbak	跳舞，戰鬥或想要戰鬥的人的搖擺	Tum_mab_bak	zinummabbak, tatummabbak, tabakka, tabakken, zinabakkan, inotabakkan, to dance, also the swaggering of those who fight, or who wish to fight. Pûtabbak, pinatabbak, papatabbak, &c. to cause such to be done.	293		晴方_274-302
Tummachal	用鏟子剷除泥土	Tum_ma_chal	zinummachal, tatummachal, tachalla, tachallen, zinachal, inotachallen, to remove the earth, as with a hoe, a spade, &c. It is changed into d see dummachol. Padachal, pinûdachal, papadachal, &c. to cause to be dug up.	293		晴方_274-302
Tummabbis	搧	Tum_mab_bis	zinummabbis, tatummabbis, tabbisa, tabbisan, zinabbisan, inotabbisan, to fan. Patabbis, pinatabbis, papatabbis, ipatabbisa, ipatabbis, inipatabbis, inoipatabbis, to cause to fan.	293		晴方_274-302
Tummach-il	贏；贏得賭注	Tum_mach-il	zinummach-il, tatummach-il, tach-illa, tach-illen, to win, to win a bet. Patach-il, pinatach-il, papatach-il, ipatach-illa, ipatach-il, inoipatach-il, to cause such to be done.	294		晴方_274-302
Tummach-o	解釋；調解	Tum_mach-o	tsi. tat. tach-oa. same as pazinado; mautadacj-o, idem patacho, nom. tattacho, interpretation, intercession. Ma-atattacho, an interpreter, an interceder.	294		晴方_274-302
Tummachum	戴上帽子；遮住頭	Tum_ma_chum	zinummachum, tatummachum, tachumma, tachumman, zinachumman, inotachumman, to put on one's hat, to cover one's head. Patachum, pinatachum, papatachum, ipatachumma, &c. to cause the hat to be put on. Tattachum, the thing put on, (namely the hat.) Tummakkum, tsi. tat. imp. takumma, part. takkumman, &c. means all kinds of covering.	294		晴方_274-302
Tummach-os	切斷	Tum_mach-os	tsi. tat. tachossan, tsinachossan, inotachossan, grass, &c. to cut off. Patachos, also chummoschos.	294		晴方_274-302
Tummagcha	砍	Tum_mag_cha	tsinummagcha, tatummagcha, tagcha, tagchaan, zinagcha, ino*agchaan, to chop, to hack to hew. Patatagcha, pi. pa. ipatagcha, inipatagcha, to cause to be chopped.	294		晴方_274-302
Tummagcho	伸出而非直立	Tum_mag_cho	zinummagcho, tatummagcho, tagcho, to overhang, not to stand upright: It is sometime changed in d, which see. Padagcho, pinadagch*, dagchoa, dagchoon, zinagcho, inodachoon, to cause to overhang: in which case it is ipadagchoa, ipadagcho, &c.	295		晴方_274-302
Tummagchoch	舀	Tum_mag_cho_ch	zinummagchoch, tatu*nmagchoch, tagchocha, tagchochen, zinagchoch, inotagchochen, to scoop. Tummagchoch o bigeno, to skim, to scoop off the forth. Patagchoch, ** natagchoch, papatagchoch, ipatagchocha, inipatagchoch, to cause to scoop. Tummagchoch o tono malla, to l*** water with a bucket.	295		晴方_274-302
Tummaies	爬上	Tum_ma_ies	zinummairs, tatummairs, **isa, taisan, zinaisan, inotaisan, to climb up. Tummaies i kittas, to climb up a ladder. Pûtaies, pinûtaies, papa***, ipataisa, ipataies, inipataies, inoip**ies, to cause to climb.	295		晴方_274-302
Tummaiba	一起做某事	Tum_mai_ba	tsi. tat. taiba, to do anything together, or in company. P** &c. to cause such to be done. ** comes aurri a teiba, that is the ** money given when people work together, as if they said, aúrëdda a teiba, so that this noun seems to come from moriedda and tummûiba, to work together. For they say also, Moriëdda o taiba, and Moribal o taibe, to leave offm to cease such working together.	295		晴方_274-302
Tummakal	戴上女人的頭帶	Tum_ma_kal	zinummakal,tatummakal, ta kalla, takallan, zinûkallan, inotakal lan, to put on a woman's head-band. Pûtakal, pinûtakal, papûtûkal, ipatakalla, &c. to cause such to be done. Written dummakal.	296		晴方_274-302
