lemma,zh-def,ori-def,ori-page
paichiech,胃痛,"pi, pa, the pain of the stomach, imp. aichiecha, pass. aichiechen, inaichiech, inoaichiechen.",194
paicham,喝；提供喝的東西,"in act. trans. imp. aichamma babosa, aichamman, inaichamman, inoaichamman,
ipaichamma, pas. pichamman, inichamman, inoichûmman, ipaicham, inipaicham, inoipûìcham, to drink, to offer to drink, aichan, nom. a drinking; ûichaman, a drinking cup.",194
paichasarra,睡覺,"pinaichasrra, papaichasarra, for the imp. people say, sarra o kagil, to sleep.",195
paies,放到旁邊；丟棄,"pinaies, papaies, aisa, ipaies, inipaies, inoipaies, to put away.",195
paya,往後靠,"pinaya, papaya, aya, ayanni, inayanni, inoayanni, to lean backwards.",195
páyach,弄髒,"pinûyach, papayach, ayacha, ayachen, inayach, inoayachen, whence iachen, ipayach, iniachen, inipayach, inoipayach, to make dirty.",195
payoch,轉過身；回頭,"pinayoch, papayoch, ayocha, to turn back, also ayochan, inayochan, inoayochan, to give back.",195
paikiek,裂掉,"pinaikiek, papaikiek, to crack.",195
pakietkiet,裂掉,"pi, pa, idem.",195
paikap,抓住；劈開,"trans. from Mikkap, which see.",195
páilieb,叫；抓住某人,"pinûilieb, papûilieb, ailieba, ailieban, inailiban, inoailiban, to call, to fetch any one. Paailieb, imp. ipaûiliba, trans. nom. ailieb, a calling.",195
pailielieb,打算,intend.,195
paior,走在某人前面；指路,"pinaior, papaior, aiorra, aiorren, inaiorren, inoaiorren, to precede any one, to shew the way; the way, aiorran, inaiorran, inoaiorran.",195
pairas,於某事上固執,"pinairas, papairas, airasû, ipairasa, to be stubborn in any thing, ipairas, inipairas, inoipairas, as pàsies, nom. airas, as asies.",196
pairoos,使⋯⋯坐下,"trans. from meroos, which see.",196
pais,使⋯⋯煩惱,"pinais, papais, aisa, aisan, inaisan, inoaisan, to pester.",196
paisis,透過齒縫吹口哨,"pi, pa, to whistle thro' the teeth.",196
páita,顯示,"pinûita, papûita, ipaita, to show; what? ipaita, inipaitû, inoipaita; to whom? aitanni, inaitanni, inoaitanni, trans. from Mita, which see.",196
pajus,吹狂風；起風暴,"pi, pa, bajussa, bajussen. binûjús, inobajûssen, to blow a gale, to storm. Pabajûs, trans. Bajûs, nom. a storm.",196
pakaqûa,謹慎地做某事,"pinakaqûa, papakaqûa, aka-qua-a, akaqûa-an, inakaqûa, inoakaqûa-an, to do any thing moderately, alsoipakaqua-a, ipakaqua-a, ipakaqua, inipakaqûa, inoipakaqûa, nom. qûa, a little, moderate, akaqûa, diminution.",196
pakaûkaû,大聲叫喊,"pinakaûkaû, papakaùkaû, akaûkaûa, akaûkaûan, inakaûkaûan, inoûkaûkaûan, to bawl out loud.",196
pakéas,將一隻腳往後伸,"pi, pa, akeassa, akéassan, inakeas, inoakéassan, to stick out one leg behind, as kûmmitta.",196
pakeas,將一隻腳往後伸,"pi, pa, ipakeassû, ipakeûs, inipakeûs, inoipakeas, to do as above, nam. akeûs, the sticking out of the leg.",197
pakibokibo,使⋯⋯煩惱,"pinakibokibo, papakibokibo, akibokiboa, to flutter, trans. from kummibokibo, which see.",197
pakikekikke,聚集,"pi, pa, akikkekikkea, to swarm, as pakikkekikke tsi. binnan.",197
pâkarot,碎裂,"pi, pa, imp. akkarótta, to crack. Pakarot, trans. nom. karot, cracked.",197
pakiliekille,以搖動的方式讓鈴響被聽到,"pi, pa, imp. akillekillea, to rattle, but so as that a ringing is heard, as from money, or the rings on the arms. Differs from paseerseer.",197
pakkio,鹿的叫聲,"pinakkio, papakkio, akkio, akkioa, the cry of deer.",197
pakkol,挖深,"pi, pa, akkolla, to dig deep.",197
pakobos,用網捕獵,"pinakobos, papakobos, akobossa, akobossan, inakobossan, inoakobossan, to hunt with nets, also ipakobossa, ipakonos, inipakobos.",197
pakótkot,母雞咯咯叫,"pi, pa, akotkótta, the cackling of hens.",197
pala,說；講,"(let the last letter be scarcely heard) pinala, papûla, ipûla, alûnni, inalanni, inoalanni, to say, to tell. Ala, nomen, a saying. This noun is compounded of karri, as karri ala, and mau, as mau ala, to converse together.",197
pala,裝飾某人；打扮某人,"trans. from Malla, which see.",198
palûblobg,用扇子搧,"pinalablabg, papalûblabg, alablûbba, alablabban, inalûblabban, inoalablabban, to fan with a fan.",198
palachach,鬆脫,"pinalachach, papalachach, alachacha, alachachen, inalachach, inoalachachen, the opposite of Padidden. See Malachach, of which this is the transitive.",198
palachach,使鬆脫；鬆鬆地放在一起,"means also to make any thing loose, to put loosely together; but then ipalachacha, ipalachach, inipalachach, inoipalachach.",
palalat,把東西放成一直排或並排,"pinalalat, papalalat, balabalata, binalabalat, balalabalatten, iiiobalabalatten, to put things in a row, or side by side. Palalat ja se malam o bausies; it differs from Palat, see Pûlalat, pinûlalat, pûpalalat, ipalalatta, ipûlalat, inipûlalat, inoipalalat, to arrange in a row, add thereto, balûlat, the noun.",198
palapilapies,使跪下,"trans. from lûmmapilapies, of malapilapies, which see.",198
pálat,把東西放成一直排，但有涉及運送方面,"pinûlat, papûlat, balatta, balatten, binalat, inobalatten, as palûlat, except that palat, extends itself to the conveying, but taken transitively, ipalûtta, ipalat, inipalat, add thereto, balat, the noun.",198
palaûlaub,閃耀；發光,"pinalaûlaûb, papalaûlaûb, laûlaûba, laûlaûban, linaûlaûban, &c.",199
pallákkûm,把某物一翻再翻,trans. from Mallakkûm,199
pallidóllido,前後跑步,"pallidóllido, pinallidóllido, papallidóllido, allidollidóa, allidollidoan, inallidollidóan, inoallidollidoan, to run backwards and forwards, spoken also of a crooked way, pallidollidoa taran.",199
pallil,吼叫和撕裂,"pi, pa, allilla, pas. allillen, inallil, inoallillen, as maûchûs, matsipi, to roar and tear. Pallillil, intend. pallil.",199
palil,噪音,"trans. allil, a noise.",199
pállo,觸及；給結婚的誓約,"pi, pa, imp. ûlloa, to reach to, to reach any thing to any one, is also used for the giving of a pledge of marriage, as &c. as the Formosans are sometimes accustomed to do. Palo, trans. nom. allo, a reaching out, a pledge, which is given as a pledge of acon tract.",199
pállossa,發現或是揭示〈某事〉給某人,"pinallossa, pûpallossa, allossa, allossanni, inallossanni, inoallossanni, to discover or reveal a little to any one.",199
palololullo,用力跺腳以製造噪音,"pinalololullo, papalololullo, allolulloan, inalololulloan, inoalololulloan, to make a noise, as by the feet of those who tread hard, or as from a shower of rain; poeple say, palololullo ja oetas.",199
pammamma,用草蓋住田,"pinamamma, papûmamma, ûmamma, to cover a field with grass; what ? amammamanni and amammayan, inamammûnni and inamammayan, inoamammanni and inoammammayan, wherewith? ipàmamma, inipamamnia, inoipamamnia.",200
pameûû,喵喵叫,"ameeûa, the mewing of cats.",200
pamoggimoggi,呢喃,"pi‚ pa‚ amoggimoggia, amoggimoggien, inamoggimoggien, inoamoggimoggien, to murmur, to mumble. Amoggimoggi, a murmuring. Ma-amoggimoggi, a murmurer.",200
pana,到,"some whither, to some place, pana Baziekan, to Batsjekan, sometimes de is added, as pana de Taiwan, to Taiwan. It is also a verb, and has in the in praet. pinana, in fut. papûna, in imperat. ûna, act. ipana, trans.",200
pan,用泥土堵住,"pinan, pûpan, banna, bannan, binannan, inobannan, to stop up with earth. Pûban, pinaban, papaban, ipabanna, ipaban, inipaban, inoipaban, to do thus; baban, a dam.",200
pannab,洗手,"pinannab, papannab, anabba, what ? annabben, inannab, inoannabben, where with ? ûnnaban, inannaban, inoannaban, the washing of the hands,",200
panno,穿上衣服；打扮自己,"pinûnno, pananno; annoa, to dress one's self, what ? annoan, inûnnoan, inoannoan, wherewith ? ipanno, inipanno, inoipanno. Pano, trans.",200
pannonnononno,蚊子嗡嗡叫,"pi, pa, the singing of musquitoes.",201
pano,幫、使他人穿衣服,"pinano, papano, to clothe another; what or who ? anoan, inamoan, inoanoan; wherewith ? ipûno, inipûno, inoipûno; see panno, a little above.",201
panoggonoggo,懇求,"pinanokkonokko, papanokkonokko, annokkonokkoa, annokkonokkoan, or anni, or aijan, inanokkonokkoan, inoanokkonokkoan, to intreat. Annoggonoggo, an intreaty.",201
pa-oa-oa,牛的叫聲,"a-oa-oû-a, the cry of crows.",201
paa-óabi,播種,"(the first a short, to distinguish it from Pû-oabi, to cause to sow;) pina-oabi, papa-óabi, a-óabia, a-óabi, inaoabi, to sow the fields; thus ûo-abian, inaoabian. Babósa, pa-oabi, the sower; adda ipa-oûbi, it is sown; Bonnaaoabian, it was sown. Aoûbi, a sowing. Aoûbian, aoabi aijan, the sowing season, or place.",201
pa-obo,提供線索,"pina-obo, papa-obo, a-obóa, a-ó-boan, inaóboan, inoa-óboan, to clue, to clue up, to draw up into a clue; also ipaóboa, ipa-obó, inipa-obo.",201
paos,一對,a pairing.,201
papacha,牡蠣,an oyster.,202
papadda,洗腳,"pinapapûdda, papapûdda, apapûdda, apapaddan, inipapaddan, inoipapaddan, to wash the feet, wherewith ? apapaddanni, or ayan, inapapaddanni, inoapapaddanni.",202
papappa,矮；短,"from Mûpappa, which see.",202
papil,使碎成數片,"from Mapil, which see.",202
papillepillik,拍合〈拍掌〉,"apillepillikka, to clap together, as two hands, two planks, &c.",202
para,跟〈某人〉在一起；陪伴,"pinûra, papara, arû, arûn, inara, inoaran, to be with any one, to accompany; araosse ta Cabba oe, does Cabba keep company? Ara, a comrade, pas. aran, inaran, to be accompanied: this passive is used with respect to those who attend on any one, as Takaba aran o Takalla, i.e. Takabba is waited on by Takala; or Takaba inara o icho, i. e. Takabba is attended by him; and aran, is also taken for the person who serves, that is the servant and maid.",202
parab,懷孕,"pinarab, paparab, iparaba, to impregnate, to get with child: see rummab, the transitive of which this is, and means, to impregnate, or to cause a woman to be pregnant, while rummab, betokens the receiver. And raben, the child; rinab is received.",202
paraba,領養小孩,"pinaraba, papûraba, ara, aran, inara, inoaran, from Para, to adopt as a child, also to give up for that purpose; in which case it is ipûraba-a, iparaba. Paraba, act. and trans. The child rûmmaka, takes another for his father. The real father lets the child be taken by another. Paraba choa, refers to those who take the child; it is also said Paraba, to take a child. An adopted father raba amosjiem. The real father iparabo. The child is called by the adopten father, aran.",203
parûllibal,弄乾亞麻,"pinarûllibal, paparûllibal, baralliballa, barûllibal, binarallibal, inobarallibal, to put out linen, &c. to dry. But has not such an extensive meaning as porra; pabarallibal, to do thus.",203
pûrapies,犯罪,"from rûmmapies, which see.",203
parar,平凡的；低下的,"from mûrar, which see.",203
parid,弄乾,"pinarid, papûrid, aridden, inarid, inoaridden, the place or part from whence, ariddan, inariddan, inoariddan, to dry up, activ. see Marid, neutr.",203
pararar,照亮；使明亮,"from Marara, which see.",203
paraût,待在外面,"from rûmmaût, which see.",203
paraûrat,在外面久待,"from rûmmaûrat, which see.",203
pardosan,嗆到〈以不正常的飲食方式才嗆到〉,"pinardosan, papardosan, to choke, as those do, who take the food or drink the wrong way. Paardosan, ipinaardosan, papaardosan, ipaardosana, &c. to do so.",203
páresshi,準備戰鬥,"pi, pa, imp. ûresshia, aresshi-in, inaresshi, inoaresshi-in, pas. iparesshi, to set up to fight, aresshi, nom. a setting on. Ma-aresshi, one who sets on.",204
pariaût,充滿,"pinûriaut, papûriaût, ariauta, ariaûtan, inariaut, inoariaut, to fill, to make full. Also to let fill, in which case ipariaûta, ipariaut, ariaut, nom.",204
pariggo,改變；使...改變,"as rûmmiggo, pinariggo, papariggo, ariggoa, ariggoan, inariggo, inoariggoan, ariggoan: see Mariggo.",204
parikoriko,分享；前後揮擺,"pinatikoriko, paparikoriko, rikorikoa, rikorikoan, rinikorikoan, to share any thing, to wave it backwards and forwards, or let such be done, in which case it is iparikorikoa, iparikoriko, iniparikoriko, &c.",204
parikak,大步跨走,see rûmmikak.,204
pario,變好；改善,"pinario, papûrio, arióa, arióan, &c. to make good. Mario, arió, an improving, a making good.",204
parrióriot,纏繞,"pi, pa, imp. arrióriotta, from Parriot, to see below; is said of ivy, &c. which climbs up long sticks or trees, and embraces them.",204
paroch-i-boch ja boesûm,清澈的天空,a clear sky.,205
parokail,把手和腳放在彼此〈身上〉,"pi, pa, arokaila, pass. arokailen, inarokail, to lay the hands or feet over each other.",205
parne,使沉浸,"pinarne, paparne, iparnea, ipûrne as rûmne. Paûrne, see rûmmene.",205
pároob,散佈乾的東西,"aroba, pass. aroban, inaroban, inoaroban ja bonna, to strew, to spread out dry things.",205
párrorro,組合；聚集,"pinarorro, paparrorro, arrorroa, arrorroan, as rûmmorro, to assemble. Parorro, pinarrorro, papûrorro, ipûrorroa, ipûrorro, iniparorro, inoiparorro, to do thus. Mind that it must be written Parorro, act. from Mûrorro.",205
párrar,用籬笆圍住,"pinarrar, paparrar, arrûrra, arrarran, inarrarran, inoarrarran, to hedge round, arrar, a hedge.",205
parrabûrra,裸體的；使某人裸體,"pinarrabarra, paparrabûrra, barrabarran, barrabarrûan, binarrabarraan, inobarrabarraan, naked, to make one's self naked.",205
párrach,通姦；亂倫,"pi, pa, iparracha, iparrach, to commit fornication. Shiem parrach, a bastard; rini pûrrach, a bee that is put in a wrong place outside the nest.",205
párras,解放；鬆手,"pinarras, paparras, bûrrasa, bûrrasan, binarrasan, to let go, to free, to put out of one's hand, to set down, in which case it is iparrasa, &c. Ma-ababarras, a redeemer. Ca Christus paga ma-ababarras o babosa, that is, Christ is the Saviour of mankind.",205
parribrieb,搖動,"pinûrribrieb, to shake, arribrieba, all kinds of shaking.",206
parri,,"trans. from Marri, which see.",206
parried,古老魔咒的迷信用法,"pinûrried, paparried, arrida, arridan, inarridan, the superstitious use of old enchantments.",206
párrinon,爭吵,"pinarrinon, paparrinon, arrinoa, to quarrel, to do that which cannot be named; rattirrien, idem.",206
párro,把...綑在一起,"pinarro, papûrro, barroa, bûrroan, binarro, to bundle up, to make up into bundle or sheaves. Pabarro, pinabarro, papabûrro,i pabûrroa, ipabarro, &c. to do thus. Barro, a sheaf.",206
párriot,把...包裹起來,"pinarriot, paparriot, ariotta, ariottan, inarriottan, to wrap up, the same as rumniot, but from another root.",206
parripiéripi,隱約地看到...,"pi, pa, imp. arripieripia, pas. parripieri-in, pinarripieri-in, with a turn of the eye, to see anything dimly.",206
parriparri,鑿一個洞,"pinarriparri, inoparriparri, parriparria, parriparri-in, pinarriparri, inoparriparri-in, to bore a hole.",206
parripieripit,含糊不清地說話,"pi, pa, arripieripitta, pass. arripieripitten. inarripieripit, to cackle, to jabber. Paripieripit, trans. arripieripit, a prating, a babbling. Ma-arripieripit a babbler.",206
párroa,挖出,"pinûrroa, papûrroa, arroa, arroan, inarroan, inoarroan, to dig out.",207
párt,弄傷；弄壞,"pinart, pûpart, arta, arten,inart, inoarten, to bruise or break any thing, as a reed, or such like.",207
pasaas,弄鬆,"pinûsaas, papûsaas, asaassen, inasaas, to occasion a looseness.",207
pasaap,縫接，讓各端重疊在一起,"pi, pa, asappa, ipasap, inipasûp, to seam, so that the ends lap over each other. Asap, nom. Trans. pasap.",207
pásaso,使游泳,"trans. from Sûmmaso, which see.",207
pasear,建置,"trans. from Masear, which see.",207
pasas,以頭或脖子搬運,"pi, pa, asasa, ipasasa, to carry on the head or on the neck, as an ox, the yoke, also to carry on the shoulders. Asasan, the place where men carry any thing; asasaù, the yoke which the ox bears.",207
pásassar,吹口哨；輕聲說話,"pinûsassar, ipasassara, ipasassar, inipasassar, inoipasassar, to whistle or say any thing softly, see Passassar.",207
pásbas,咬平；啃平,"pinabas, papûsbas, basbassa, basbassen, binasbas, inobasbassen, to bite flat, to gnaw even.",207
paseerseer,無噪音地喋喋不休,"pi, pa, imp. aseerseer, to rattle without noise. See Pakillekille.",207
páshadda,在房子上蓋屋頂,"pinûshadda, papûshadda, ipashadda, inipûshadda, inoipashadda, to put a roof on the house.",208
pási,剝殼,"pi, pa, asia, asian, inasian, inoasian, ipasi, pass, ipasi, inipasi, inoipûsi, to shell. Asi, a peeling.",208
páshimit,用手撫摸,"pi, pa, imp. ashimda, pass. ashimdan, to stroke with the hand.",208
pasinok,擤鼻子,"pinasinok, papasinok, ipasinokka, ipûsinok, inipasinok, inoipasinok, to blow the nose; see Passinok.",208
pashemar,塗抹；摩擦,"pinûshemar, papûshemar, ashemûrra, ashemûrran, inashemarran, inoashemarran, to smear, to rub over; wherewith ? ipashemar, inipaahemar, inoipasjemar, to let the same be done, in which case it is ipashemarra, ipashemar, &c. as above. Sashemar, fat.",208
pasies,暴躁的；勇敢的,"fiery, courageous, pasies o ramied, bold in words, to boast, to vaunt. Pasies o mababat, proud in one's gait. Asies, nom, lofty. Ma-asies, one who is bold.",208
pasiet,感冒；咳嗽,"piasiet, papûsiet, having taken cold, to cough. Asiet, a cough.",208
passhir,放下,"pinashir, papasshir, isshirra, to put anything down or in. Pashir, trans. nom. sashir, the putting any thing down, sûshiran, or sashirayan, the place where men put anything down. Sûshiran o tûttullo, contracted, sashiran tûttûllo, a trader.",208
pashi,沿著...經過,"to pass along. Pashi abas, along the sea shore. Móso, ditto.",209
pasinsin,頭痛,"pinsiansin, papasinsin, the head-ache.",209
passhipir,灑水,"pi, pa, asshipirra, to sprinkle with water, same as babichi; ashipir, nom. subst, a sprinkling.",209
pasíksik,使...扣上鈕扣,"pinasiksik, papasiksik, asiksikka, asiksikken, inasiksik, inoasiksikken, as pûdidden; in this form it is active, so also mûsisisik, but imp. ipasiksikka, pass. ipasiksik, inipasiksik, inoipasiksik; from sûmmiksik.",209
pasisiet,讓食物冷卻,"pinàsisiet, papûsisiet, asisita, asisiten, inasisiet, inoasisiten, to cool any food that is hot, also to let cool; in which case it is ipasisita, ipasisiet.",209
pasisse,搖響〈像是壞掉的銅鑼〉,"and Pasissississese, to rattle, as a broken gong, the bell &c.",209
pûsoa,傷害；使受傷,"pinasoa, papasoa, asoû, ûsoan, inûsoa, inoasoan, or soan, sinoan, to wound, to cause to be wounded, in which case it is ipûsoa, inipasoa.",209
pasobi,散佈；撒乾的物體,"pinasobi, papasibo, ipasobia, ipasobi, inipasobi, inoipasobi, to strew and sprinkle with any thing dry, as salt, sand, &c.",209
pasoeisoei,用嘴巴吹口哨,"pinasoeisoei, papasoeisoei, asoeisoeia, to whistle with the mouth.",210
pásoes,使聽見,"pinûsoes, papûsoes, ipûsoesa, ipasoes, inipasoes, inoipûsoes, to cause to hear. Pabûsoes, pinabûsoes, papabasoes, ipapûssoesa, ipûpassoes, inipapassoes, inoipapassoes, ditto.",210
pásoes,親吻,see under passos.,210
pûsor,使兩個原本應連接但卻分離的東西相連,"p, pa, imp, asorra, pass. ipasorra, to join together two things that are separated from each other, and which ought to be united, as two houses, two letters, &c.",210
pasosot,分發,"pinasosot, papasosot, asosota, asosotan, inasosotan, inoasosotan, to deal out, to distribute, what ? asosoten, inûsosoot, inoasosoten, or ipûsosot.",210
paspas,綿綿下雨,"pi, pa, paspûssa, paspûssen, pinaspûssen, inopaspûssen, to rain gently. Paaspas, trans. Paspas, nom. a muzzling rain.",210
passabo,在兩物之中搬運,"pinûssabo, papûssabo, assabóa, assabon, inassabo, inoassabon, to carry anything between two. Pasabo, pinâsabo, papasabo, ipûsaboa, ipûsabo, inipasabo, inoipasabo, to do thus.",210
pûssapa,口齒不清地說話,"pinassapa, papassapa, to lisp.",210
passasar,竊竊私語,"pinassassar, papassassar, assassûrra, assassûrran, inassassarran, inoassassarran, to whisper.",211
passhadda,蓋住房子,"pinasshadda, papasshadda, to cover a house, what ? asshadda, asshaddanni. inassiaddanni, wherewith ? ipashaddan, sipashadda, &c.",211
pûssinok,擤鼻涕,"pinûssinok, papûssinok, assinokka, assinokkan, to blow the nose.",211
pûssobi,以乾的物體散佈；撒,"pinûssobi, papûssobi, assobia, assobian, inassobian, inoassóbian, to strew with anything dry, as salt, &c.",211
pûsso,做竹繩,"pinasso, papûsso, bassoa, bassoan, binassoan, inobassoan, to make a string of bamboo.",211
pûssopietpiet,縫接,"pinassopietpiet, papassopietpiet, assopietpieta, assopietpietan, inassopietpietan, inoassopietpietan, to seam. Pasopietpiet, pi, pa, ipasopietpieta, ipasopietpiet, inopasopiepiet, inoipasopietpiet, to cause to be hemmed.",211
passoes,鑽孔,"a bore. Passos, pi, pa, pûssossa, passosan, pinassosan, to bore.",211
pasopir,用網捕魚,"pi, pa, assopirra, assopirran, inassopirran, inoassopirran, to fish with a cast net. Pasopir, pi, pa, ipasopirra, ipasopir, to fish thus. Assopir, such fishing; also the instrument employed, a cast net.",211
passos,親吻,"pi, pa, bassosa, bassosan, binûssosan, inobassosan, to kiss. Pabassos, pi, pa, ipabûssosa, ipabassos, inipabassos. Babûssos, a kiss, nom.",212
passoso,給；呈現,"pinûssoso, papûssoso, assosoa, to whom ? assosoan, inassosoûn, inoassosoan, to give, to present, to give for nothing: what ? ipassos, inipassoso, inoipassoso, ditto. Passok, pi, pa, imp. assokka, from whence seems to be derived the name of the village Assok, which is the noun, from the verb passok, meaning a gift; because the site of the village Assok was formerly given to the inhabitants of Tamachan. Psaoso, trans. a gift.",212
pûtach,把牙齒染黑,"pinûtach, papûtach, ipûtacha, ipatach, inipûtach, inoipatach, to make the teeth black. See pattach.",212
pûtapa,從上面掉下來,"pinûtapa, papûtapa, to let anything fall down from above, what ? ipûtapa, ipatapa, inipatapa, inoipatapa, on whom ? atapa-a, atapa-an, inatûpa-an, inoatapaûn; also to do thus, in which case it is ipatapa, &c.",212
patippo,用步槍射擊,"pinàtippo, papatippo, atippoa, atippoan, inatippóan, inoatippoan, to shoot with a musket, or to cause to shoot, in which case it is inoatippoa, ipatippo, inipatippo, inoipatippo.",212
patis,丟掉；輸,"pinatis, papatis, ipatissa, ipatia, inipatis, inoipatis, to throw away or lose, trans. from Matis, which see.",213
patoóm,讓狗玩在一起,"pi, pa, atoamma, atoamman, &c. to let dogs play together.",213
patarion,把...放在後面,"pi, pa, papatta-arion, to put any thing behind. See Matarron.",213
passikasûr,把...放在另一個東西上面,"pi, pa, assikasarra, to lay one over the other.",213
patsikir,雲雀的叫聲,"pi, pa, atsikirra, the singing of the larks, nom. tsikir.",213
pûttach,染黑牙齒,"pinattach, papattach, attacha, attachan, to blacken the teeth.",213
pattaggai,短暫的時間、一分鐘,as Paggai.,213
patsiliek,麻雀的叫聲,the chattering of sparrows.,213
pattadach,使溫暖,"pinattadach, papattadach, atadacha, atadachen, to warm. Patadach, pi, pa, ipatadacha, ipatadach, inipatadach, to make warm.",213
pattala,繼〈父、母…〉,"is never used alone, but Mau patala, stepfather; Naij patala, stepmother; Shiem patala, stepson; Atoasa patala, stepbrother, or stepsister.",213
pattallaijach,躺在某人背上,"pinattallaijach, papattallaijach, attallaijacha, attallaijachan, inattallaijachen, to lie on one's back. Patallaijach, pinattallaijach, papatallaijach, ipatallaijach, ipatallaijacha, to put on the back.",213
pattallakkûm,,"pinattallakkum, papatallakkum, atallakkumma, inatallakkumman, inoatallakkumman, as Pallakkum. But patallakkûm, pinatallakkûm, papatallakkum, ipatallakkumma, ipatallakkûm, inipatallakkûm, inoipatallkkûm, as palakkum.",214
pattap,縫補破洞或裂縫,"pinattap, papattap, attappa, attappen, inattappan, inoattappan, to up a hole or rent, either with patching, darning, or plaiting.",214
pûttapa,掉落,"pinattapa, papattapa, to fall, to fall down, as the drops of water from the roof; hence attapa-an, inatapa-an, inoatapa-an, to cause to fall; patapa; hence attapa, nom. a drop.",214
pattûrran,讓路,"pinattarran, papattarran, atarrana, atarranen, inatarran, inoatarrannen, to get out of the way, to make room. To cause that such be done. Patarran, pinatarran, papatarran, ipatarrana, ipatarran, &c.",214
patûrrigi,幫兇,"from Matarrigi, which see.",214
pattas,畫畫；寫字,"pinattas, papattas, atassa, atassen, inattassan, inoattassan, to paint, to write. Patas, pinatas, papattas, ipatassa, ipatas, to cause to be written or painted.",214
pattaûlieb,把...握在後面；下面,"pinattaulieb, papattaûlieb, ataûliba, ataûliban, inataûliban, inoataûliban, to hold any thing behind or under one. PataûlieB, pinataûlieb, papataûlieb. ipataûliba, ipataûlieb, inipataûlieb, to shelter any one.",215
pattaûso,治癒,"pinattaûso, papattaûso, ataûsoa, ataûsoan, inataûso, to heal. Pataûso, pinataûso, papataûso, ipataûsoa, ipataûso, to cause to be healed.",215
pattó,耳鳴,"pinatto, the tingling in the ears.",215
pattaûte,無意間生火,"pinattaûte, papattaûte, attaûtea, attaûtin, inataûte, inoatautin, unexpectedly to take fire. Pataute, pinataûte, papataûte, ipataûtea, ipataûte, inipataûte, inoipataûte, to do thus.",215
pattûzies,做稻草人,"pinattazies, papattazìes, attazisa, to make a scare crow, pass. ipattazìes, inipattazies, inoipatazies, that of which a scare crow is made. Also to set up a scare crow, in which case it is attazisan, inattazisan, inoattaziaan. Patazies, pi, pa, ipatazies, ipatazisa, inipatazies, to do thus.",215
